Image_ID,Image_file_link,MSA_Caption,Sudanese_Caption,Region,Audio_file_link,Category,Collection_method,Source_license,Secondary_category
IMG_000470.jpg,Google drive,أرض ترابية مزروعة بأشجار النخيل تحيط بها في جميع الاتجاهات,ارض تراب فيها شجر نخيل مزروع داير ما يدور,الولاية الشمالية,Audio_link,Nature & Landscape,Licened Public(Wikimedia common),"CC BY-SA 4.0,BY Hussan Kamal Mohammed",
IMG_000471.jpg,Google drive,مجرى مائي تحيط به خضرة وارفة وأرض ترابية ناعمة وحجارة,موية جارية وحولينها في خدار قايم وترابة ناعمة وحجار,الولاية الشمالية,Audio_link,Nature & Landscape,Licened Public(Wikimedia common),"CC BY-SA 3.0,BY Fdevillard",
IMG_000472.jpg,Google drive,سلاسل جبال الفحم في طريق بورتسودان ويوجد فيه اشجار علي جانب الطريق,سلسلة جبال الفحم في طريق بورتسودان و فيهو شجر بجنب الطريق,ولاية البحر الأحمر,Audio_link,Nature & Landscape,Own recording,Permission Form,
.IMG_000373.jpg,Google drive,شخص يحمل كوبًا من القهوة أمام بحر بورتسودان، وفي البحر سفينة تحمل رافعات,زول شايل كباية جبنة قدام بحر بورتسودان وفيهو سفينة شايلة رافعات,ولاية البحر الأحمر,Audio_link,Nature & Landscape,Own recording,Permission Form,
IMG_000474.jpg,Google drive,حقول زراعية في وسط غروب الشمس,فدانات/ ارض زراعة في وسط غروب الشمس,,Audio_link,Nature & Landscape,A friend Submission,Permission Form,
IMG_000475.jpg,Google drive,نهر النيل جاري يحتوي في وسطه على جزيرة صغيرة، ويحيط به شريط خضرة ممتد من بدايته إلى نهايته,نيل جاري في نصه في جزيرة صغيرة وحولينه شريط خدار ممتد من بدايته لنهايته,مروي/الولاية الشمالية,Audio_link,Nature & Landscape,Direct Permission,Permission Form,
IMG_000476.jpg,Google drive,طريق العقبة الواصل إلى مدينة بورتسودان يمر بين جبلين كبيرين,طريق العقبة البودي بورتسودان بين جبلين كبار,,Audio_link,Nature & Landscape,Direct Permission,Permission Form,
IMG_000477.jpg,Google drive,جمل يقف في عشب كثيف محاط بأشجار,جمل واقف في نجيلة غزيرة فيها شجر,ولاية دارفور,Audio_link,Nature & Landscape,Licened Public(Wikimedia common),"CC BY-SA 4.0,BY YOUSUF AHMED HAMID FUDOL",
IMG_000478.jpg,Google drive,شتلات داخل مشتل توجد في أكياس متينة صغيرة وأصص للزينة والسقف مغطى بغطاء شبكي,شتلات في مشتل خاتنها في شوالات صغيرة وفي اصايص زينة ومغطين السقف بسران مقدقد,ولاية القضارف,Audio_link,Nature & Landscape,A friend Submission,Permission Form,
IMG_000479.jpg,Google drive,شارع حصوي يمر وسط الخضرة والأشجار الممتدة على طوله,شارع ظلط في نص الخدار والشجر الممتدة على طوله,ولاية القضارف,Audio_link,Nature & Landscape,A friend Submission,Permission Form,
IMG_000480.jpg,Google drive,جمل جالس في وسط العشب، وخلفه جبل مغطى بالخضرة,جمل قاعد في نص النجيلة و وراه جبل مغطى بالخدار,ولاية شمال دارفور,Audio_link,Nature & Landscape,Direct Permission(Nile organaization),Permission Form,
IMG_000481.jpg,Google drive,حديقة زهور تحتوي على أنواع مختلفة من الزهور والشتلات والأشجار,حديقة ورود فيها انواع مختلفة من الورود والشتلات والشجر,ولاية الخرطوم,Audio_link,Nature & Landscape,Direct Permission,Permission Form,
IMG_000482.jpg,Google drive,وادي يحتوي على تلال وجبال متوسطة الحجم كلها مغطاة بالعشب والخضرة وتنتشر فيه نباتات قائمة رؤوسها بيضاء,وادي فيهو تلال وجبال وسط وكلهم مغطين بالنجيلة والخدار وفيهو نباتات قايمة راسها ابيض,ولاية جنوب كردفان,Audio_link,Nature & Landscape,Direct Permission,Permission Form,
IMG_000483.jpg,Google drive,رجل يقف تحت ظل شجرة التبلدي، وحوله مساحات من العشب,زول واقف تحت ضل شجرة التبلدي وحولينها نجيلة,ولاية جنوب كردفان,Audio_link,Nature & Landscape,Direct Permission(Nile organaization),Permission Form,
IMG_000484.jpg,Google drive,منازل ذات سقف مخروطي، محاطة بأرض خضراء وأشجار، وخلفها جبال,قطاطي في نص الخدار والشجر والتلال و وراهم جبال,ولاية جنوب كردفان,Audio_link,Nature & Landscape,Direct Permission(Nile organaization),Permission Form,
IMG_000485.jpg,Google drive,منظر البحر في وقت غروب الشمس,منظر البحر في وقت غروب الشمس,ولاية النيل الأبيض,Audio_link,Nature & Landscape,Licened Public(Wikimedia common),"CC BY-SA 3.0,BY محسن الفكي",
IMG_000486.jpg,Google drive,جسر فوق البحر تمر عليه سيارات وشاحنات ناقلة محمَّلة بالحاويات,كبري فوق البحر ماشين فيهو عربات ولوري شايل حاويات,ولاية الخرطوم,Audio_link,Nature & Landscape,Direct Permission,Permission Form,
IMG_000487.jpg,Google drive,بستان يحتوي على ورود القطيفة الصفراء والبرتقالية,بستان فيهو ورود القطيفة الصفرا والبرتقالية,ولاية الخرطوم,Audio_link,Nature & Landscape,Direct Permission,Permission Form,
IMG_000488.jpg,Google drive,أرض خضراء وخلفها سلسلة جبال التاكا، يفصل بينهما كثافة من الأشجار,ارض خضرا وراها جبال التاكا فاصل بينهم شجر كتير,ولاية كسلا,Audio_link,Nature & Landscape,Afriend Submission,Permission Form,
IMG_000489.jpg,Google drive,قارب في البحر وأمامه جسر معلق فوق المياه، وذلك في وقت غروب الشمس,مركب في البحر وقدامه كبري معلقنو فوق البحر في وقت غروب الشمس,ولاية البحر الأحمر,Audio_link,Nature & Landscape,Licened Public(Unsplash),Unsplash Licened,
IMG_000490.jpg,Google drive,ازهار صباح الخير المتفتحة بألوان وردي وأصفر,ورود صباح الخير فاتحة لونها بمبي واصفر,ولاية القضارف,Audio_link,Nature & Landscape,A friend Submission,Permission Form,
IMG_000491.jpg,Google drive,امرأة ترتدي جلابية وطرحة كبيرة، تمشي في وسط زقاق سوق شعبي، تحيط به دكاكين أمام بعضها البعض,مرة لابسة جلابية وطرحة كبيرة ماشة في نص زقاق سوق شعبي وحولينهو دكاكين فاتحة في بعض,الخرطوم/ولاية الخرطوم,Audio_link,Marketplaces,Licened Public(Pixabay),Pixabay licened,
IMG_000492.jpg,Google drive,بائعٌ يقف خلف طاولةٍ، وقد وضع البصل في السِّلَّة، وبجانبه طاولةٌ أخرى عليها بطيخٌ في السوق,بياع واقف ورا طربيزة وخاتي البصل في الملوة وجمبو طربيزة بطيخ في السوق,نيالا / ولاية جنوب دارفور,Audio_link,Marketplaces,Licened Public(Wikimedia common),public domain,
IMG_000493.jpg,Google drive,فلفلٌ أخضرُ مُكوَّمٌ بعضُه فوق بعض، وخلفه بطاطسٌ مُفرَّغةٌ في أكياسٍ من الخيش داخل السوق,شطة خدرا مكومة فوق بعض و وراها بطاطس فارشنو في الخيش في السوق,مدينة الأبيض/ ولاية شمال كردفان,Audio_link,Marketplaces,Licened Public(Wikimedia common),"CC BY-SA 4.0, BY WADALYEMEN",
IMG_000494.jpg,Google drive,منضدة خشبية متواضعة تعرض ثمار الطماطم والليمون تحت ظلال الأشجار الوارفة,طربيزة خدار بسيطة مختوتة تحت الضل فيها طماطم وليمون في نص الحلة ,نيالا / ولاية جنوب دارفور,Audio_link,Marketplaces,Licened Public(Wikimedia common),"CC0 1.0, BY MARIAM ELHUSSEIN",
IMG_000495.jpg,Google drive,أكوامٌ من البطيخِ موضوعةٌ على الأرضِ في أحدِ الأسواق.,اكوام  بتاعت بطيخ مختوتة في الواطة في سوق من الاسواق,كوستي / ولاية النيل الأبيض,Audio_link,Marketplaces,Licened Public(Wikimedia common),"CC BY 4.0, BY HASSAN HASSOON",
IMG_000496.jpg,Google drive,تُعرضُ تمورُ النخيلِ الوفيرةُ داخلَ سلالٍ  تحتَ ظلالِ المظلاتِ القماشية في السوق,أنواع مختلفة من البلح مختوتة في سباتة تحت مظلة في السوق,أم درمان / ولاية الخرطوم,Audio_link,Marketplaces,Licened Public(Wikimedia common),"CC BY 3.0, BY KHALED ELSAED",
IMG_000497.jpg,Google drive,بهاراتٌ وتمر ولوبياء حمراء موضوعةٌ في طساس حديدية داخل محلِّ بيع بجوار محل الجزارة في السوق,بهارات وبلح وبليلة عدسية قاعدين في طشاتة حديد في محل بيع جمب جزارة في السوق,الخرطوم / ولاية الخرطوم,Audio_link,Marketplaces,Licened Public(Wikimedia common),"CC BY-SA 3.0 CZ, BY PETR ADAM DOHNÁLEK",
IMG_000498.jpg,Google drive,فتى يعمل في جزارة، يقوم بسلخ وتقطيع الخراف المذبوحة المُعلَّقة,ولد شغال في جزارة وشغال يسلخ ويقطع في الخرفان المضبوحة المعلقة,,Audio_link,Marketplaces,Licened Public(Wikimedia common),"CC BY 4.0, BY RAMBOSD",
IMG_000499.jpg,Google drive,أكياسٌ من الخيش تحتوي على بلحٍ وكركديهَ وبهاراتٍ داخل محلِّ عطارة,شوالات خيش فيها بلح وكركدي وبهارات في عطارة,أم درمان / ولاية الخرطوم,Audio_link,Marketplaces,Licened Public(Wikimedia common),"CC BY 4.0, BY RAMBOSD",
IMG_000500.jpg,Google drive,ثياب وقمصان وتنانير نسائية معلقة داخل بوتيك,تياب وقمصان واسكيرتات نسوان معلقة في بوتيك ,,Audio_link,Marketplaces,Direct Permission,Permission Form,
IMG_000501.jpg,Google drive,حمار يجر عربة يجلس فيها شخص، ويسير في وسط سوق شعبي، وأمامه مسجد كبير داخل السوق,كارو راكب فيهو زول وماشي في نص سوق شعبي و قدامو مسجد كبير في السوق,شندي / ولاية نهر النيل,Audio_link,Marketplaces,Direct Permission,Permission Form,
IMG_000502.jpg,Google drive,بساط صغير لرجل يبيع فيه الفقوس وقصب حلو,فرشة صغيرة لي راجل بيبيع فيها تبش وعنكوليب,,Audio_link,Marketplaces,Direct Permission,Permission Form,
IMG_000503.jpg,Google drive,رجل جالس على كرسي يبسط الفقوس على الأرض لبيعه,راجل قاعد في الكرسي وفارش تبش في الواطة ببيع فيهو,,Audio_link,Marketplaces,Direct Permission,Permission Form,
IMG_000504.jpg,Google drive,دوارق بلاستيكية ملونة معروضة أمام محل للأواني، وبمقابلها دكان لفرش الأرض,جكاكة بلاستيك بي الوان مختلفة مختوتة قدام محل عدة وقدامو دكان بتاع فرشات,مدينة دنقلا / الولاية الشمالية,Audio_link,Marketplaces,Direct Permission,Permission Form,
IMG_000505.jpg,Google drive,سلال من سعف النخيل وضعت فيها أصناف متنوعة من التمر.,قفف بتاعت جريد نخيل مختوت فيها انواع مختلفة من البلح,مدينة دنقلا / الولاية الشمالية,Audio_link,Marketplaces,Direct Permission,Permission Form,
IMG_000506.jpg,Google drive,أطباق متنوعة بأغطيتها وأواني طهي من الألمنيوم بجانبها حافظات مياه معروضة أمام محلات السوق,صحانة مشكلة بغطاياتها و حلل المونيوم جنبهم حفاظات موية قاعدين معروضات قدام محلات السوق,مدينة دنقلا / الولاية الشمالية,Audio_link,Marketplaces,Direct Permission,Permission Form,
IMG_000507.jpg,Google drive,ثمار التمر الهندي واللوبياء الحمراء والنبق موضوعة داخل سلال من سعف النخيل في وسط السوق,عرديب و بليلة عدسية ونبق مختوتين في قفف بتاعت جريد نخيل في نص السوق,مدينة دنقلا / الولاية الشمالية,Audio_link,Marketplaces,Direct Permission,Permission Form,
IMG_000508.jpg,Google drive,طاولات عليها دلاء بلاستيكية وملابس وأحذية معروضة أمام محل في سوق مزدحم,طرابيز بتاعات جرادل بلاستيك وهدوم وجزم مفروشات قدام محل في سوق زحمة,أم درمان / ولاية الخرطوم,Audio_link,Marketplaces,Licened Public(Wikimedia common),"CC BY-SA 3.0 CZ, BY PETR ADAM DOHNÁLEK",
IMG_000509.jpg,Google drive,بناية تجارية في وسط السوق تضم عيادات أطباء وتوكيلات ووكالات سفر,عمارة تجارية في نص السوق فيها مكاتب دكاترة و توكيلات ووكلات سفر,أم درمان / ولاية الخرطوم,Audio_link,Marketplaces,Licened Public(Wikimedia common),"CC BY-SA 4.0, BY ASIM",
IMG_000510.jpg,Google drive,حافظات مياه ملونة بأحجام مختلفة وأواني معدنية مرصوفة أمام متجر للأدوات المنزلية,صبارات موية الوانها واحجامها مختلفة و عدة بتاعت استيل مرصوصات قدام دكان عدة,الخرطوم / ولاية الخرطوم,Audio_link,Marketplaces,Licened Public(Wikimedia common),"CC BY-SA 3.0 CZ, BY PETR ADAM DOHNÁLEK",
IMG_000511.jpg,Google drive,أوعية كبيرة مملوءة بالكركديه واللالوب والتمر والتوابل الجافة موضوعة أمام متجر للعطارة,طشاتة مليانة كركدي ولالوب وبلح وبهارات ناشفة مختوتات قدام محل بهارات,الأبيض / ولاية شمال كردفان,Audio_link,Marketplaces,Licened Public(Wikimedia common),"CC BY-SA 4.0, BY WADALYEMEN",
IMG_000512.jpg,Google drive,بناء قديم في السوق يضم متاجر كثيرة,مبنى قديم في سوق فيهو دكاكين كتيرة,كريمة / الولاية الشمالية,Audio_link,Marketplaces,Licened Public(Wikimedia common),"CC BY 3.0, BY BERTRAMZ",
IMG_000513.jppg,Google drive,مركبة ثلاثية العجلات تسير في السوق، وبجانبها بسطات لبيع البطيخ ومتاجر للفاكهة,ركشة ماشة في سوق وجمبها فرشات بطيخ ومحلات بتاعت فواكه,نيالا / ولاية جنوب دارفور,Audio_link,Marketplaces,Licened Public(Wikimedia common),"CC0 1.0, BY MARIAM ELHUSSEIN",
IMG_000514.jpg,Google drive,متجر لبيع القطن والتنجيد، فيه أكياس من الخيش مليئة بالقطن، ومراتب ووسائد ملونة مرصوفة فوق بعضها,دكان بتاع قطن وتنجيد فيهو قطن في شوالات خيش ومراتب ومخدات ملونة قاعدة فوق بعض,ود مدني / ولاية الجزيرة,Audio_link,Marketplaces,Licened Public(Wikimedia common),"CC BY 3.0, BY BERTRAMZ",
IMG_000515.jpg,Google drive,متجر تموينات ومخبز وصيدلية في السوق البريطاني,بقالة ومخبز وصيدلية  في السوق البريطاني ,بورتسودان / ولاية البحر الأحمر,Audio_link,Marketplaces,Licened Public(Wikimedia common),"CC BY 3.0, BY BERTRAMZ",
IMG_000516.jpg,Google drive,جبال التاكا وامامها تظهر مباني سوق كسلا,جبال التاكا وقدامها المباني بتاعت سوق كسلا ,مدينة كسلا / ولاية كسلا,Audio_link,Marketplaces,Licened Public(Wikimedia common),"CC BY-SA 4.0, BY AHMED HAMID FUDOL",
IMG_000517.jpg,Google drive,توابل كاملة ومطحونة موضوعة في أوعية كبيرة أمام متجر للعطارة,بهارات حب ومسحونة خاتينها في طشاتة في دكان بهارات,,Audio_link,Marketplaces,Direct Permission,Permission Form,
IMG_000518.jpg,Google drive,أكياس من الخيش مليئة بالتوابل وأحذية جلدية تقليدية وحقيبة من القبعات عند مدخل متجر شعبي في السوق,شوالات بهارات و مراكيب جلد و كيس بتاع طواقي في مدخل بتاع دكان شعبي في السوق,,Audio_link,Marketplaces,Direct Permission,Permission Form,
IMD_000519.jpg,Google drive,ازدحام مروري أمام بنايات صيانة الهواتف المحمولة,زحمة بتاعت عربات قدام عمارات تصليح التلفونات ,أمدرمان /ولاية الخرطوم,Audio_link,Marketplaces,Licened Public(Wikimedia common),"CC BY-SA 4.0, BY NOORY TAHA",
IMG_000520.jpeg,Google drive,سوق للماشية يعج بالتجار والمشترين,سوق البهايم فيهو تجار وناس دايرة تشتري,أمدرمان /ولاية الخرطوم,Audio_link,Marketplaces,Licened Public(Meddle East Monitor),CC BY-SA 4.0 BY Abdullah Uluyurt/Anadolu Agency,
IMG_000521.jpeg,Google drive,أشخاص يقفون أمام متجر لبيع الأكياس البلاستيكية، وبجانبه أكياس ممتلئة بالفحم والبصل في السوق,ناس واقفة قدام دكان ببيع اكياس بلاستيك وجمبو اكياس معبية فحم وبصل في السوق,بحري / ولاية الخرطوم,Audio_link,Marketplaces,Licened Public(Wikimedia common),"CC BY-SA 3.0, BY ELTOUM",
IMG_000522.jpg,Google drive,بسطات لبيع الخضروات وتجمعات للناس عند مواقف الحافلات وأمامهم مسجد في قلب السوق,فرشات بتاعت خدار وناس ملمومة في المواصلات وقدامهم جامع في السوق ,مدينة دنقلا / الولاية الشمالية,Audio_link,Marketplaces,Licened Public(Wikimedia common),"CC BY 3.0, BY BERTRAMZ",
IMG_000523.jpg,Google drive,أكياس من زبدة الفول السوداني وأمامها مظلة كبيرة لبيع الخضروات في السوق المركزي,اكياس بتاعت دكوة وقدامها مظلة كبيرة بتاعت خدار في السوق المركزي,مدينة كوستي / ولاية النيل الأبيض,Audio_link,Marketplaces,Licened Public(Wikimedia common),"CC BY 4.0, BY HASSAN HASSOON",
IMG_000524.jpg,Google drive,رجل يقوم بتعبئة الدقيق في أكياس داخل مطحنة في السوق,راجل قاعد يعبي في دقيق في كيس جوا طاحونة في السوق ,أمدرمان /ولاية الخرطوم,Audio_link,Marketplaces,Licened Public(Wikimedia common),"CC BY-SA 4.0, BY AHMED HAMID FUDOL",
IMG_000525.jpg,Google drive,طاولة لعرض الأواني المعدنية، تضم أطباقاً بأغطيتها وأباريق ومصنوعات فخارية,طربيزة بتاعت عدة استيل فيها صحانة بغطاياتها وجكاكة وعدة فخارية,,Audio_link,Marketplaces,Direct Permission,Permission Form,
IMG_000526.jpg,Google drive,تاجر يضع سمك البلطي على الميزان داخل سوق شعبي للأسماك,تاجر خاتي سمك بلطي في ميزان في سوق سمك شعبي,,Audio_link,Marketplaces,Direct Permission,Permission Form,
IMG_000527.jpg,Google drive,سوق مكتظ يضم باعة للخضروات والفاكهة وعربات يدوية وخلفهم دكاكين للبيع,سوق زحمة فيهو بياعين خدار وفواكه ودرداقات ودكاكين بيع وراهم,المناقل /ولاية الجزيرة,Audio_link,Marketplaces,Direct Permission,Permission Form,
IMG_000528.jpg,Google drive,شارع في السوق تصطف على جانبيه متاجر للتوابل والبقوليات,شارع في سوق فيهو دكاكين بتاعت بهارات وبقوليات بالجهتين,,Audio_link,Marketplaces,Direct Permission,Permission Form,
IMG_000529.jpg,Google drive,رجل يجلس وأمامه عربته اليدوية المحملة بقصب السكر، وهو يضع القطع الصغيرة داخل الأكياس,راجل قاعد وخاتي درداقتو بتاعت قصب السكر قدامو وبدخل في القصب المقطع في الكيس,,Audio_link,Marketplaces,Direct Permission,Permission Form,
IMG_000530.jpg,Google drive,مشهد علوي لبائع زلابية وبجانبه بسطات مفروشة في الارض,صورة بي فوق لي راجل بيبيع لقيمات وجنبو في فرشات في الواطة,الروصيرص / ولاية النيل الأزرق,Audio_link,Marketplaces,Direct Permission,Permission Form,
IMG_000531.jpg,Google drive,شجرة نيم ضخمة، تستظل تحتها منصة خشبية صغيرة لبيع رصيد الهواتف واللبان والحلويات,شجرة نيم كبيرة تحتها طبلية صغيرة بتاعت رصيد ولبان وحلاوات,,Audio_link,Marketplaces,Direct Permission,Permission Form,
IMG_000532.jpg,Google drive,مدخل متجر للمواد الغذائية، يعرض أصنافاً متنوعة من البقوليات والكركديه وأعواد القرفة، وخلفها تصطف أكياس كبيرة من الدقيق والسكر,مدخل دكان مواد تموينية فيه بقوليات مختلفة و كركدي وقرفة ووراهم في شوالات دقيق وسكر,المناقل /ولاية الجزيرة,Audio_link,Marketplaces,Direct Permission,Permission Form,
IMG_000533.jpg,Google drive,شارع ترابي يعرض فيه باعة البطيخ بضائعهم على الارض، بينما توضع الفواكه فوق عربات يدوية، وفي مقابله ازدحام مروري,شارع تراب فيهو ناس فارشة بطيخ في الواطة وفواكه في الدرداقات بتبيع  فيهم وقدامو زحمة عربات,بحري /ولاية الخرطوم,Audio_link,Marketplaces,Licened Public(Wikimedia common),"CC BY-SA 4.0, BY ASIM",
IMG_000534.jpg,Google drive,محل في السوق يعرض الفاصوليا والفول والتبلدي المر في أوعية حديدية، وبجانبها أوعية زيت بلاستيكية,فاصوليا وفول مصري وعرديب مختوتين في طشاتة حديد و جركانات زيت في محل في السوق,المناقل /ولاية الجزيرة,Audio_link,Marketplaces,Direct Permission,Permission Form,
IMG_000535.jpg,Google drive,توابل وزيوت وبقوليات معروضة امام متجر للمواد الغذائية في السوق,بهارات وزيوت وبقوليات قاعدين في دكان بتاع مواد تموينية في السوق,,Audio_link,Marketplaces,Licened Public(Wikimedia common),"CC BY-SA 3.0, BY PETR ADAM DOHNÁLEK",
IMG_000536.jpg,Google drive,متجر للاحذية النسائية، يعرض صنادل ملونة مصطفة على جدار المحل,دكان شباشب نسوان الوانها مختلفة معروضة في الحيطة بتاعت الدكان ,,Audio_link,Marketplaces,Direct Permission,Permission Form,
IMG_000537.jpg,Google drive,متجر للأحذية الرجالية، يعرض صنادل جلدية بألوان متنوعة معلقة على جدار المحل,شباشب رجالية بتاعت جلد بي الوان مختلفة معلقة في الحيطة بتاعت الدكان ,,Audio_link,Marketplaces,Direct Permission,Permission Form,
IMG_000538.jpg,Google drive,متجر البركة يضم محلات للجزارة مفتوحة داخل سوق شعبي,دكان البركة فيهو جزارات فاتحين في سوق شعبي ,بحري /ولاية الخرطوم,Audio_link,Marketplaces,Licened Public(Wikimedia common),"CC BY-SA 3.0, BY ELTOUM",
IMG_000539.jpg,Google drive,صنادل جلدية رجالية معلقة على باب متجر مطل على زقاق في السوق,شباشب رجال بتاعت جلد معلقة في باب دكان فاتح في زقاق في السوق,,Audio_link,Marketplaces,Licened Public(Wikimedia common),CC BY-SA 2.0 BY anmade,
